{
  "$schema": "https://json-schema.org/draft/2020-12/schema",
  "$id": "KDEN_V375_R14_ACQUISITION_PASS_V1",
  "type": "object",
  "additionalProperties": false,
  "required": [
    "schema_version", "record_id", "scope_id", "status", "run_id",
    "completed_at_utc", "predecessor_hashes", "artifact_hashes",
    "gate_evidence", "record_sha256"
  ],
  "properties": {
    "schema_version": {
      "enum": [
        "KDEN_V375_R14_PRODUCT_ACQUISITION_PASS_V1",
        "KDEN_V375_R14_COMBINED_ACQUISITION_PASS_V1"
      ]
    },
    "record_id": {
      "enum": ["WRFSFCF_R14", "WRFSUBHF_Q05_R14", "R14"]
    },
    "scope_id": {"const": "KDEN_V375_R14_V1"},
    "product": {"enum": ["wrfsfcf", "wrfsubhf"]},
    "status": {"const": "PASS"},
    "run_id": {"type": "string"},
    "completed_at_utc": {"type": "string", "format": "date-time"},
    "predecessor_hashes": {"type": "object"},
    "artifact_hashes": {"type": "object"},
    "gate_evidence": {"type": "object"},
    "record_sha256": {"type": "string", "pattern": "^[0-9a-f]{64}$"}
  }
}
