{"artifact_hashes":{"reports/step_05_r14_acquisition_report_v375.json":"b7006c09712d8d9ad8bd72bbdaecda1a13a796bf054aa41a40f6abc31662c4ad"},"completed_at_utc":"2026-09-21T18:54:15.989412Z","gate_evidence":{"combined_request_count":true,"combined_work_unit_count":true,"hourly_product_pass":true,"hourly_then_q05_phase_order":true,"one_owner_run":true,"product_checkpoints_independent":true,"q05_product_pass":true,"shared_maximum_eight_workers":true},"predecessor_hashes":{"R14_READY_FOR_OWNER_RUN":"8ac9f990dffb77a4226a9c96df3f17b38e1c21331c6f0ccf0012c94ce65b8861","WRFSFCF_R14":"f875d83d0c3ddde8193b9df4fb7f74b8050ccc7fb2cf14e78fcc3749fe65c2ec","WRFSUBHF_Q05_R14":"1e0492b846704e5dd167bc2a2a2cc485cf83cc17dfa50e106342553ff8278cf0"},"record_id":"R14","record_sha256":"0852fea463aaad9b4b65ce5c103c45605a0b13ccd338914911b025b1aff8ecfb","run_id":"kdenv375-s05-owner-full-20260915T014537Z-r14-acquisition","schema_version":"KDEN_V375_R14_COMBINED_ACQUISITION_PASS_V1","scope_id":"KDEN_V375_R14_V1","status":"PASS"}
